{
  "protocol_version": "runtime-contract.v1",
  "schema_version": "mcp-discovery-snapshot.v1",
  "document_type": "mcp-discovery-snapshot",
  "run_id": "run-1",
  "session_id": "session-1",
  "execution_request_hash": "sha256:2222222222222222222222222222222222222222222222222222222222222222",
  "profile": {
    "document_type": "mcp-profile",
    "artifact_id": "engineering-readonly",
    "revision": 1,
    "hash": "sha256:b24375aac9dd709f7c7c6848fbe8f3bf0faf062d8c17e0eb0b766e357a4a3451"
  },
  "created_at": "2026-09-01T10:00:00.000Z",
  "expires_at": "2026-09-01T10:05:00.000Z",
  "stale": false,
  "servers": [
    {
      "server_id": "github",
      "binding_name": "github",
      "transport": "agentgateway",
      "protocol_revision": "2025-06-18",
      "server": {
        "name": "github-mcp",
        "version": "1.2.3",
        "identity_hash": "sha256:3333333333333333333333333333333333333333333333333333333333333333"
      },
      "tools": [
        {
          "alias": "repo.search",
          "native_name": "search_repositories",
          "input_schema_hash": "sha256:eeeeeeeeeeeeeeeeeeeeeeeeeeeeeeeeeeeeeeeeeeeeeeeeeeeeeeeeeeeeeeee",
          "output_schema_hash": "sha256:ffffffffffffffffffffffffffffffffffffffffffffffffffffffffffffffff",
          "operation_class": "read-only",
          "annotations": {
            "read_only_hint": true,
            "destructive_hint": false,
            "idempotent_hint": true,
            "open_world_hint": true
          }
        }
      ]
    }
  ],
  "document_hash": "sha256:fde47fceea9abbf5cd11974cd37bb390ecb61f6e2b9176637d2275890ccf4852"
}
